{
  "eventTimestamp": "2019-10-15T09:06:10.285218Z",
  "publishedTimestamp": "2019-10-15T09:06:15.285218Z",
  "traceId": "40634dfc-b8bc-44b5-9353-161ac0b0e80b",
  "vehicleRef": "XYZ0123X0X0123456",
  "journeyPatternRef": "RUT:JourneyPattern:123",
  "quayRef": "NSR:Quay:123",
  "order": 1,
  "distanceMeter": 32.5,
  "position": [10.7522, 59.9139],
  "delaySeconds": -10,
  "doorsOpen": false
}